[
  {"id": "IMP-001", "title": "Lorentz-invariant wave propagation validates modified KG baseline", "domain": "relativistic", "tier_relevance": ["REL-01", "REL-02", "REL-05"], "summary": "Stable Lorentz-invariant propagation in the lattice indicates the modified Klein–Gordon baseline reproduces special relativistic behavior within tolerance.", "derivation": "REL-* tests measure isotropy and invariance; dispersion within expected stencil error bands implies no unphysical preferred frame at tested scales.", "evidence_tests": ["REL-01", "REL-02", "REL-05"], "chain_of_reasoning": ["If lattice supports Lorentz-invariant modes → relativistic kinematics are preserved", "Preserved kinematics → downstream EM and gravity-analogue models can be consistent", "Therefore core PDE is a plausible substrate for multi-physics unification"], "potential_claim_types": ["theory", "standard", "dataset"], "ip_strategy": "defensive-publication", "prior_art_delta": "Discretized modified KG with spatially varying χ validated against an energy-first harness with GPU reproducibility.", "required_followup_work": ["Higher-order stencil convergence study", "Continuous-time extrapolation"], "maturity_level": "validated", "risk_assessment": {"likelihood": "high", "impact": "high"}, "enabling_requirements": ["GPU-accelerated solver", "Canonical laplacian single-source"], "market_impact": ["Scientific credibility", "Foundation for later applications"], "ethical_considerations": [], "severity_if_false": "Undermines all chained implications relying on relativistic fidelity.", "cross_dependencies": [], "links": [], "created": "2025-11-11", "updated": "2025-11-11"},
  {"id": "IMP-002", "title": "Energy conservation within 1e-4 enables long-horizon simulations", "domain": "energy", "tier_relevance": ["ENER-01", "ENER-03", "ENER-07"], "summary": "Observed low drift enables thousands of steps without renormalization, allowing reliable metric extraction.", "derivation": "Tier 3 energy tests bound drift; Verlet temporal scheme shows dt^2 scaling; spatial dispersion dominates but controlled by dx.", "evidence_tests": ["ENER-01", "ENER-03"], "chain_of_reasoning": ["Low drift → trust integral quantities (energy, momentum)", "Trusted integrals → validates emergent behaviors (binding, tunneling) measured over time"], "potential_claim_types": ["method", "software", "dataset"], "ip_strategy": "defensive-publication", "prior_art_delta": "Energy-first validation embedded into harness and gating process.", "required_followup_work": ["Adaptive dt exploration", "Energy partition diagnostics export"], "maturity_level": "validated", "risk_assessment": {"likelihood": "high", "impact": "high"}, "enabling_requirements": ["Deterministic GPU kernel", "Canonical energy calculator"], "market_impact": ["Trust in results", "Publishable evidence"], "ethical_considerations": [], "severity_if_false": "Metrics over long runs become unreliable.", "cross_dependencies": ["IMP-001"], "links": [], "created": "2025-11-11", "updated": "2025-11-11"},
  {"id": "IMP-003", "title": "χ-field as potential landscape for gravity analogue", "domain": "gravity-analogue", "tier_relevance": ["GRAV-01", "GRAV-12"], "summary": "Spatial modulation of χ produces redshift/time-dilation analogues observable in wave propagation timing.", "derivation": "Modified mass term shifts local dispersion; wave packet delays and frequency shifts mimic gravitational potential.", "evidence_tests": ["GRAV-01", "GRAV-12"], "chain_of_reasoning": ["χ gradient → dispersion shift → group velocity modulation", "Group delay differences → red/blue shift analogue"], "potential_claim_types": ["theory", "method", "apparatus"], "ip_strategy": "provisional", "prior_art_delta": "Field-mass modulation approach anchored to lattice KG with validated energy conservation.", "required_followup_work": ["Benchmark vs known GR solutions", "3D potential wells"], "maturity_level": "evidence", "risk_assessment": {"likelihood": "medium", "impact": "very-high"}, "enabling_requirements": ["Precise χ synthesis", "High SNR timing"], "market_impact": ["Education", "Sensor testbeds"], "ethical_considerations": [], "severity_if_false": "Gravity analogue path weakens; other domains unaffected.", "cross_dependencies": ["IMP-001", "IMP-002"], "links": [], "created": "2025-11-11", "updated": "2025-11-11"},
  {"id": "IMP-004", "title": "Quantum tunneling metrics reproducible without cryogenics", "domain": "quantization", "tier_relevance": ["QUAN-03", "QUAN-07"], "summary": "Barrier transmission/reflection profiles emerge from PDE dynamics, enabling room-temperature wave logic experiments.", "derivation": "Wave packet interaction with χ-barrier yields T/R coefficients; conservation confirms numerical fidelity.", "evidence_tests": ["QUAN-03"], "chain_of_reasoning": ["Tunneling analogue → wave-based logic primitives", "Logic primitives → neuromorphic or analog compute designs"], "potential_claim_types": ["method", "apparatus", "software"], "ip_strategy": "provisional", "prior_art_delta": "Energy-first validation and canonical χ barrier construction with GPU-backed reproducibility.", "required_followup_work": ["Parameter sweep automation", "Stability windows"], "maturity_level": "evidence", "risk_assessment": {"likelihood": "medium", "impact": "high"}, "enabling_requirements": ["Accurate χ barriers", "FFT-based spectrum estimation"], "market_impact": ["Accelerators", "Signal processing"], "ethical_considerations": [], "severity_if_false": "Undermines wave logic track.", "cross_dependencies": ["IMP-002"], "links": [], "created": "2025-11-11", "updated": "2025-11-11"},
  {"id": "IMP-005", "title": "EM compliance via wave equation limit implies unified modeling", "domain": "electromagnetic", "tier_relevance": ["EM-01", "EM-12", "EM-21"], "summary": "Recovering EM-like propagation characteristics enables using a single substrate for optics/rf simulation.", "derivation": "In suitable χ configurations the PDE reduces to wave-equation-like dynamics; validated by propagation speed and mode shapes.", "evidence_tests": ["EM-12", "EM-21"], "chain_of_reasoning": ["EM-like modes → optics and antenna co-simulation", "Co-simulation → reduced toolchain fragmentation"], "potential_claim_types": ["theory", "software", "apparatus"], "ip_strategy": "pct-ready", "prior_art_delta": "Single KG-based substrate spanning EM/quantum/relativistic with verified energy metrics.", "required_followup_work": ["Boundary condition library", "Material parameter mapping"], "maturity_level": "evidence", "risk_assessment": {"likelihood": "medium", "impact": "very-high"}, "enabling_requirements": ["Boundary handling", "Dispersion control"], "market_impact": ["EDA/CAE convergence"], "ethical_considerations": [], "severity_if_false": "Requires domain-specific solvers instead of one substrate.", "cross_dependencies": ["IMP-001", "IMP-002"], "links": [], "created": "2025-11-11", "updated": "2025-11-11"},
  {"id": "IMP-006", "title": "Dispersion engineering through χ for metamaterials", "domain": "materials", "tier_relevance": ["EM-12", "QUAN-04"], "summary": "Programmatic χ fields act as effective materials enabling negative index, slow light, and cloaking analogues.", "derivation": "Spatial χ patterns tailor local dispersion surfaces, producing engineered group velocities and refraction.", "evidence_tests": ["EM-12"], "chain_of_reasoning": ["χ pattern → dispersion control", "Dispersion control → metamaterial behaviors"], "potential_claim_types": ["method", "apparatus", "software"], "ip_strategy": "provisional", "prior_art_delta": "Field-mass control rather than micro-structure; simulated and validated energy-conserving behavior.", "required_followup_work": ["Optimize χ synthesis algorithms", "Robustness to noise"], "maturity_level": "hypothesis", "risk_assessment": {"likelihood": "medium", "impact": "high"}, "enabling_requirements": ["High-resolution χ control"], "market_impact": ["RF/optics components"], "ethical_considerations": ["Camouflage misuse"], "severity_if_false": "Limits scope of χ to basic potential wells.", "cross_dependencies": ["IMP-005"], "links": [], "created": "2025-11-11", "updated": "2025-11-11"},
  {"id": "IMP-007", "title": "Analog computing primitives (adder, integrator) via wave interference", "domain": "computation", "tier_relevance": ["QUAN-02", "EM-01", "ENER-02"], "summary": "Interference and barrier logic form building blocks for analog accelerators.", "derivation": "Linear PDE superposition enables arithmetic via phase/amplitude encoding; barriers implement nonlinear transfer-like effects.", "evidence_tests": ["QUAN-02"], "chain_of_reasoning": ["Stable interference → deterministic analog operations", "Operations chain → domain-specific accelerators"], "potential_claim_types": ["method", "apparatus", "software"], "ip_strategy": "provisional", "prior_art_delta": "Validated on unified PDE substrate with energy audits and GPU reproducibility.", "required_followup_work": ["Noise/error modeling", "I/O encoding schemes"], "maturity_level": "hypothesis", "risk_assessment": {"likelihood": "medium", "impact": "high"}, "enabling_requirements": ["Low-dispersion configs", "Stable boundary conditions"], "market_impact": ["Edge AI", "Signal processing"], "ethical_considerations": [], "severity_if_false": "Restricts value to simulation only.", "cross_dependencies": ["IMP-002", "IMP-004"], "links": [], "created": "2025-11-11", "updated": "2025-11-11"},